10995037,Ensure Better Regulatory Compliance: SEBI Tells Vedanta,https://www.bloombergquint.com/business/ensure-better-regulatory-compliance-sebi-tells-vedanta
10995025,UK cuts gap between second dose and booster jabs for vulnerable groups,https://www.moneycontrol.com/news/trends/health-trends/uk-cuts-gap-between-second-dose-and-booster-jabs-for-vulnerable-groups-7655421.html
10995026,Prince Andrew Mounts Attack Against Woman Who Accused Him of Sexual Abuse,https://www.moneycontrol.com/news/world/prince-andrew-mounts-attack-against-woman-who-accused-him-of-sexual-abuse-7655371.html
10995044,"Yes Bank, Bank Bazaar Launch Credit Card Built: Check All Features",https://www.ndtv.com/business/yes-bank-launches-credit-card-in-partnership-with-bank-bazaar-that-allows-tracking-of-credit-worthiness-2593586
10995027,"PM Modi meets Pope Francis, discusses COVID crisis and climate change",https://www.moneycontrol.com/news/india/pm-modi-meets-pope-francis-discusses-covid-crisis-and-climate-change-7655151.html
10995028,"Vijaypat Singhania: As we all age, we start to lose confidence in ourselves",https://www.moneycontrol.com/news/trends/features/how-v-k-singhania-signed-away-his-37-17-stake-in-raymond-and-came-to-regret-it-7646351.html
10995029,G20 leaders endorse global minimum corporate tax deal for 2023 start,https://www.moneycontrol.com/news/world/g20-leaders-endorse-global-minimum-corporate-tax-deal-for-2023-start-7655321.html
10995032,"Gold prices expected to reach Rs 52-53,000 mark in next 12 months: MOFS",https://economictimes.indiatimes.com/markets/commodities/news/gold-prices-expected-to-reach-rs-52-53000-mark-in-next-12-months-mofs/articleshow/87396951.cms
10995033,"Gold set to sparkle this 'Diwali'; drop in price, pent-up demand to drive sales: Jewellers",https://economictimes.indiatimes.com/markets/commodities/news/gold-set-to-sparkle-this-diwali-drop-in-price-pent-up-demand-to-drive-sales-jewellers/articleshow/87396625.cms
10995030,Maruti Suzuki expects adverse impact on production next month due to semiconductor shortage,https://www.moneycontrol.com/news/technology/auto/maruti-suzuki-expects-adverse-impact-on-production-next-month-due-to-semiconductor-shortage-7655361.html
10995031,Karnataka govt issues new guidelines for 2021 Diwali celebrations; check details here,https://www.moneycontrol.com/news/trends/current-affairs-trends/karnataka-govt-issues-new-guidelines-for-2021-diwali-celebrations-check-details-here-7655141.html
10995034,Goldman now sees Fed hiking rates in July as inflation lingers,https://economictimes.indiatimes.com/markets/bonds/goldman-now-sees-fed-hiking-rates-in-july-as-inflation-lingers/articleshow/87396183.cms
10995007,GE's 'New HorAIzons' opens up a world of technological possibilities for the new normal,https://www.moneycontrol.com/news/trends/features/ges-new-horaizons-opens-up-a-world-of-technological-possibilities-for-the-new-normal-7653151.html
10995022,"Sebi warns Vedanta over related-party transactions worth Rs 1,407 cr",https://www.business-standard.com/article/companies/sebi-warns-vedanta-over-related-party-transactions-worth-rs-1-407-cr-121103000671_1.html
10995008,Review | 'Call My Agent Bollywood' offers a satirical peek into how the filmy universe of Mumbai works,https://www.moneycontrol.com/news/trends/entertainment/review-call-my-agent-bollywood-offers-a-satirical-peek-into-how-the-filmy-universe-of-mumbai-works-7655311.html
10995010,How holding on to great businesses helps build your wealth,https://www.moneycontrol.com/news/business/markets/how-holding-on-to-great-businesses-helps-build-your-wealth-7655281.html
10995016,Wall Street Week Ahead: Stocks approach historically strong period but Fed taper looms,https://economictimes.indiatimes.com/markets/stocks/news/wall-street-week-ahead-stocks-approach-historically-strong-period-but-fed-taper-looms/articleshow/87395556.cms
10995024,Indian Oil Q2 Results: Profit Up 7% Aided By Other Income,https://www.bloombergquint.com/business/indian-oil-q2-results-profit-up-7-aided-by-other-income
10995011,Hospitals may use beds reserved for COVID cases for dengue patients: Delhi govt,https://www.moneycontrol.com/news/trends/health-trends/hospitals-may-use-beds-reserved-for-covid-cases-for-dengue-patients-delhi-govt-7655131.html
10995019,"IRCTC MD on Railways scrapping fee-sharing order, normalisation of biz",https://economictimes.indiatimes.com/markets/expert-view/irctc-md-on-railways-scrapping-fee-sharing-order-normalisation-of-biz/articleshow/87395185.cms
10995013,Thousands of fish die as river suddenly turns black in Arunachal Pradesh,https://www.moneycontrol.com/news/trends/current-affairs-trends/thousands-of-fish-die-as-river-suddenly-turns-black-in-arunachal-pradesh-7655291.html
10995014,Time to shift part of portfolio from outperforming stocks to some defensive ones,https://www.moneycontrol.com/news/business/markets/time-to-shift-part-of-portfolio-from-outperforming-stocks-to-some-defensive-ones-7655261.html
10995015,"Daily Voice | Nifty may not scale new highs in November series, says Mohit Nigam of Hem Securities",https://www.moneycontrol.com/news/business/markets/daily-voice-nifty-may-not-scale-new-highs-in-november-series-says-mohit-nigam-of-hem-securities-7655101.html
10994997,Samvat 2078 will likely see bulls ruling the Dalal Street,https://www.moneycontrol.com/news/business/markets/samvat-2078-will-likely-see-bulls-ruling-the-dalal-street-7655161.html
10995021,"IOC Q2 results: Profit growth flat at Rs 6,235 cr; firm declares Rs 5 dividend",https://economictimes.indiatimes.com/markets/stocks/earnings/ioc-q2-results-profit-growth-flat-at-rs-6235-cr-firm-declares-rs-5-dividend/articleshow/87394037.cms
10995023,Banks To Remain Closed On These Days In November 2021: Full List Here,https://www.ndtv.com/business/bank-holidays-in-november-2021-banks-to-remain-closed-for-these-days-in-november-2021-full-list-here-2593458
10994998,The Kashmiri apple industry is bruised. And climate change has a lot to do with it,https://www.moneycontrol.com/news/trends/features/the-kashmiri-apple-industry-is-bruised-and-climate-change-has-a-lot-to-do-with-it-7655051.html
10995050,View: A digital rupee and cryptocurrencies can (and should) co-exist,https://economictimes.indiatimes.com/markets/cryptocurrency/view-a-digital-rupee-and-cryptocurrencies-can-and-should-co-exist/articleshow/87393487.cms
10994999,SEBI warns Vedanta over related-party transactions,https://www.moneycontrol.com/news/business/markets/sebi-warns-vedanta-over-related-party-transactions-7655181.html
10995000,Why Dabur made a dash for the diaper segment,https://www.moneycontrol.com/news/business/companies/why-dabur-made-a-dash-for-the-diaper-segment-7655121.html
10995001,"Nykaa, Policybazaar, Sigachi, SJS Enterprises IPOs: Check the latest grey market premium",https://www.moneycontrol.com/news/business/ipo/nykaa-policybazaar-sigachi-sjs-enterprises-ipos-check-the-latest-grey-market-premium-7653741.html
10995006,5 years of continuous service mandatory for tax free EPF withdrawal,https://www.livemint.com/money/personal-finance/5-years-of-continuous-service-mandatory-for-tax-free-epf-withdrawal-11635582573841.html
10994987,In Pics | PM Narendra Modi arrives in Vatican City to meet Pope Francis,https://www.moneycontrol.com/news/photos/world/in-pics-pm-narendra-modi-arrives-in-vatican-city-to-meet-pope-francis-7654801.html
10994988,"PM Modi will be more powerful as Congress not serious about politics, says Mamata Banerjee; seeks to end Delhi's 'dadagiri'",https://www.moneycontrol.com/news/politics/pm-modi-will-be-more-powerful-as-congress-not-serious-about-politics-says-mamata-banerjee-seeks-to-end-delhis-dadagiri-7655091.html
10994996,Applications Invited For Post Of SEBI Chairman In Place Of Ajay Tyagi,https://www.ndtv.com/business/sebi-chairman-government-invites-applications-for-post-of-sebi-chairman-in-place-of-ajay-tyagi-2593387
10994993,Dalal Street Week Ahead: Nifty looks set for technical pullback in truncated week,https://economictimes.indiatimes.com/markets/stocks/news/dalal-street-week-ahead-nifty-looks-set-for-technical-pullback-in-truncated-week/articleshow/87391719.cms
10994989,Donald Trump's social media platform a Mastodon rip-off ?,https://www.moneycontrol.com/news/technology/donald-trumps-social-media-platform-a-mastodon-rip-off-7654871.html
10994994,ETMarkets Investors' Guide: How will rising inflation impact domestic markets?,https://economictimes.indiatimes.com/markets/stocks/etmarkets-podcast/etmarkets-investors-guide-how-will-rising-inflation-impact-domestic-markets/podcast/87391815.cms
10994990,"Exclusive | API Holdings, owner of PharmEasy, all set to file DRHP for its IPO next week: Sources",https://www.moneycontrol.com/news/business/companies/exclusive-api-holdings-owner-of-pharmeasy-all-set-to-file-drhp-for-its-ipo-next-week-sources-7655081.html
10994995,Will HNIs upset the IPO apple cart for retail investors?,https://economictimes.indiatimes.com/markets/stocks/news/will-hnis-upset-the-ipo-apple-cart-for-retail-investors/articleshow/87391232.cms
10994991,China has given 75.8% of population complete COVID-19 vaccine doses: Health official,https://www.moneycontrol.com/news/trends/health-trends/china-has-given-75-8-of-population-complete-covid-19-vaccine-doses-health-official-7655061.html
10994971,Power Ministry proposes amendments in EC Act to boost renewable energy consumption,https://www.thehindu.com/news/national/power-ministry-proposes-amendments-in-ec-act-to-boost-renewable-energy-consumption/article37247112.ece
10994972,Review | Paresh Rawal and Ratna Pathak Shah shine as parents for hire in 'Hum Do Hamare Do',https://www.moneycontrol.com/news/trends/entertainment/review-paresh-rawal-and-ratna-pathak-shah-shine-as-parents-for-hire-in-hum-do-hamare-do-7654841.html
10994985,Here Are The Reasons Behind Bitcoin's Popularity Among Investors,https://www.ndtv.com/business/bitcoin-vs-dollar-rate-why-are-investors-rallying-behind-bitcoin-2589744
10994974,"Market falls 2% in 5 days on continuous FIIs selling, mixed Q2 earnings",https://www.moneycontrol.com/news/photos/business/markets/market-falls-2-in-5-days-on-continuous-fiis-selling-mixed-q2-earnings-7654091.html
10994975,In Pics | Puneeth Rajkumar's fans throng Kanteerava stadium to pay last respects,https://www.moneycontrol.com/news/photos/trends/in-pics-puneeth-rajkumars-fans-throng-kanteerava-stadium-to-pay-last-respects-7654661.html
10994976,I-T portal functioning properly as Infosys fixes 90% glitches: Sources,https://www.moneycontrol.com/news/business/infosys-fixes-90-glitches-in-i-t-portal-assures-smooth-running-7654701.html
10994984,Festival season home loan offers: Are they worth it?,https://www.livemint.com/money/personal-finance/festival-season-home-loan-offers-are-they-worth-it-11635576271722.html
10994981,Michael Steinhardt's tips on how to achieve long-term investment success,https://economictimes.indiatimes.com/markets/stocks/news/michael-steinhardts-tips-on-how-to-achieve-long-term-investment-success/articleshow/87389728.cms
10994978,"The Tippling Point | Forget gin, try these whiskey cocktails for Diwali",https://www.moneycontrol.com/news/trends/features/the-tippling-point-forget-gin-try-these-whiskey-cocktails-for-diwali-7654691.html
10994979,"Market losses over 2% amid profit-booking during the week, end month a tad better",https://www.moneycontrol.com/news/business/markets/market-losses-over-2-amid-profit-booking-during-the-week-end-month-a-tad-better-7654381.html
10994980,"Managing your portfolio, investing in IPOs & value-buying opportunities this Diwali with Nilesh Shah",https://www.moneycontrol.com/news/business/technicals/managing-your-portfolio-investing-in-ipos-value-buying-opportunities-this-diwali-with-nilesh-shah-7654671.html
10994963,Google's Locked Folder feature for Photos will come to iOS next year,https://www.moneycontrol.com/news/technology/googles-locked-folder-feature-for-photos-will-come-to-ios-next-year-7654601.html
10994964,"Thousands pay tribute to late Kannada star Puneeth Rajkumar; CM Basavaraj Bommai, other ministers also pay last respects",https://www.moneycontrol.com/news/trends/entertainment/thousands-pay-tribute-to-late-kannada-star-puneeth-rajkumar-cm-basavaraj-bommai-other-ministers-also-pay-last-respects-7654651.html
10994986,"Petrol, Diesel Rates Hiked On Saturday. Petrol Nears Rs 109-Mark In Delhi",https://www.ndtv.com/business/petrol-and-diesel-price-today-october-30-2021-petrol-diesel-prices-touch-record-highs-on-saturday-check-latest-rates-here-2593305
10994970,Taiwan has no future other than reunification with China: FM Wang Yi,https://www.business-standard.com/article/current-affairs/taiwan-has-no-future-other-than-reunification-with-china-fm-wang-yi-121103000451_1.html
10994965,Moneycontrol Pro Weekender | Finding true value ,https://www.moneycontrol.com/news/business/markets/moneycontrol-pro-weekender-finding-true-value-7653581.html
10994966,"Rockwell Automation India Concludes “India Inc. on the Move,” Aims to Make India Global Manufacturing Hub",https://www.moneycontrol.com/news/trends/features/rockwell-automation-india-concludes-india-inc-on-the-move-aims-to-make-india-global-manufacturing-hub-7653461.html
10994967,Former Himachal Pradesh Minister GS Bali passes away,https://www.moneycontrol.com/news/trends/current-affairs-trends/former-himachal-pradesh-minister-gs-bali-passes-away-7654541.html
10994969,Oberoi Realty Q2 results: Co reports net profit at Rs 267 cr,https://economictimes.indiatimes.com/markets/stocks/earnings/oberoi-realty-q2-results-co-reports-net-profit-at-rs-267-cr/articleshow/87388029.cms
10994968,Nervousness after a big fall in market advocates alterations using options: Shubham Agarwal,https://www.moneycontrol.com/news/trends/expert-columns/nervousness-after-a-big-fall-in-market-advocates-alterations-using-options-shubham-agarwal-7654331.html
10994944,Tech Weekender: Top news from the world of technology this week,https://www.moneycontrol.com/news/technology/tech-weekender-top-news-from-the-world-of-technology-this-week-7654511.html
10994945,Over 13% polling till 9 am in Ellenabad bypoll in Haryana,https://www.moneycontrol.com/news/trends/current-affairs-trends/over-13-polling-till-9-am-in-ellenabad-bypoll-in-haryana-7654561.html
10994959,LIVE updates: Aryan Khan walks out of jail; bypolls underway in 3 LS seats,https://www.business-standard.com/article/current-affairs/latest-news-live-updates-30-october-2021-news-highlights-121103000279_1.html
10994946,Drugs-on-cruise case: Aryan Khan walks out of Arthur Road Jail after 28 days,https://www.moneycontrol.com/news/trends/drugs-on-cruise-case-aryan-khan-walks-out-of-arthur-road-jail-after-28-days-7654081.html
10994947,By-election in Ellenabad is a test of farmers' ballot power,https://www.moneycontrol.com/news/politics/by-election-in-ellenabad-is-a-test-of-farmers-ballot-power-7654401.html
10994962,The Mutual Fund Show: Tips To Let Your Portfolio Bare Its FAANGs,https://www.bloombergquint.com/business/the-mutual-fund-show-tips-to-let-your-portfolio-bare-its-faangs
10994948,CoP26: Empty pledges in Glasgow won’t cool down an overheated planet,https://www.moneycontrol.com/news/world/cop26-empty-pledges-in-glasgow-wont-cool-down-an-overheated-planet-7654521.html
10994961,Mutual Funds for SIP of 20 years,https://www.livemint.com/money/personal-finance/mutual-funds-for-sip-of-20-years-11635570761299.html
10994950,"India logs 14,313 new COVID-19 cases, 549 deaths; active cases at 1,61,555",https://www.moneycontrol.com/news/trends/health-trends/india-logs-14313-new-covid-19-cases-549-deaths-active-cases-at-161555-7654471.html
10994949,"Jackie Chan, Balerion and Smaug inspire names of gecko species described from Western Ghats",https://www.moneycontrol.com/news/world/jackie-chan-balerion-and-smaug-inspire-names-of-gecko-species-described-from-western-ghats-7654311.html
10994954,Diwali Muhurat Picks: 2 Tata stocks among 10 ideas from Motilal Oswal,https://economictimes.indiatimes.com/markets/stocks/news/diwali-muhurat-picks-2-tata-stocks-among-10-ideas-from-motilal-oswal/slideshow/87387193.cms
10994951,Do you have a good marketing team to drive revenues?,https://www.moneycontrol.com/news/business/do-you-have-a-good-marketing-team-to-drive-revenues-7654501.html
10994941,IL&FS gets NCLT nod for InvIT,https://www.thehindu.com/business/Industry/ilfs-gets-nclt-nod-for-invit/article37246247.ece
10994952,"ICC Men's T20 World Cup 2021: Pakistan vs New Zealand Report – Bowlers, Asif Ali help Pakistan make it two wins in a row",https://www.moneycontrol.com/news/trends/sports-trends/icc-mens-t20-world-cup-2021-pakistan-vs-new-zealand-report-bowlers-asif-ali-help-pakistan-make-it-two-wins-in-a-row-7654421.html
10994953,Meta: Facebook's high-stakes bet to save itself,https://www.moneycontrol.com/news/world/meta-facebooks-high-stakes-bet-to-save-itself-7654411.html
10994925,T20 World Cup 2021 | England vs Australia: Old foes meet on the big stage again,https://www.moneycontrol.com/news/trends/sports-trends/t20-world-cup-2021-england-vs-australia-old-foes-meet-on-the-big-stage-again-7654371.html
10994926,"MC Interview | Nykaa deserves premium valuation and it'll remain for some time, says Karan Taurani of Elara Capital",https://www.moneycontrol.com/news/business/ipo/mc-interview-nykaa-deserves-premium-valuation-and-itll-remain-for-some-time-says-karan-taurani-of-elara-capital-7653931.html
10994955,"Policybazaar raises Rs 2,569 cr from insurance cos, anchors",https://economictimes.indiatimes.com/markets/ipos/fpos/policybazaar-raises-rs-2569-cr-from-insurance-cos-anchors/articleshow/87386222.cms
10994927,10 US states sue Biden administration over COVID-19 vaccine rule,https://www.moneycontrol.com/news/world/10-us-states-sue-biden-administration-over-covid-19-vaccine-rule-7654361.html
10994956,Nykaa IPO subscribed 4.82 times on Day 2,https://economictimes.indiatimes.com/markets/ipos/fpos/nykaa-ipo-subscribed-4-82-times-on-day-2/articleshow/87386141.cms
10994928,5 apps to improve teamwork and productivity in the hybrid office,https://www.moneycontrol.com/news/trends/features/5-apps-to-improve-teamwork-and-productivity-in-the-hybrid-office-7654231.html
10994957,Will buy Indian stocks on every fall: Chris Wood,https://economictimes.indiatimes.com/markets/stocks/news/will-buy-indian-stocks-on-every-fall-chris-wood/articleshow/87385972.cms
10994929,"Needle-free vaccine patches coming soon, say researchers and makers",https://www.moneycontrol.com/news/trends/health-trends/needle-free-vaccine-patches-coming-soon-say-researchers-and-makers-7654321.html
10994958,Ethereum jumps to record high amid crypto’s decentralized boom,https://economictimes.indiatimes.com/markets/cryptocurrency/ethereum-jumps-to-record-high-amid-cryptos-decentralized-boom/articleshow/87385961.cms
10994935,"Mobikwik, Oyo Rooms and Delhivery to soon join the IPO startup party",https://economictimes.indiatimes.com/markets/ipos/fpos/mobikwik-oyo-rooms-and-delhivery-to-soon-join-the-ipo-startup-party/articleshow/87385810.cms
10994930,T20 World Cup 2021| West Indies vs Bangladesh: West Indies stay alive with thrilling win,https://www.moneycontrol.com/news/trends/sports-trends/t20-world-cup-2021-west-indies-vs-bangladesh-west-indies-stay-alive-with-thrilling-win-7654301.html
10994938,G-20 heads to endorse overhaul of how countries tax multinational companies,https://www.business-standard.com/article/economy-policy/g-20-heads-to-endorse-overhaul-of-how-countries-tax-multinational-companies-121103000309_1.html
10994931,PM Modi to hold one-on-one meeting with Pope Francis in Vatican City,https://www.moneycontrol.com/news/trends/current-affairs-trends/pm-modi-to-hold-one-on-one-meeting-with-pope-francis-in-vatican-city-7654291.html
10994936,Adani Group picks up stake in Cleartrip,https://economictimes.indiatimes.com/markets/stocks/news/adani-group-picks-up-stake-in-cleartrip/articleshow/87385767.cms
10994932,New data show Fed's inflation debate still unresolved,https://www.moneycontrol.com/news/business/economy/new-data-show-feds-inflation-debate-still-unresolved-7654251.html
10994933,"World leaders to talk climate, economy, vaccines at G20",https://www.moneycontrol.com/news/world/world-leaders-to-talk-climate-economy-vaccines-at-g20-7654241.html
10994934,United States consumer spending up a modest 0.6% with inflation high,https://www.moneycontrol.com/news/business/economy/united-states-consumer-spending-up-a-modest-0-6-with-inflation-high-7654201.html
10994937,D-Street indices fall for third day in a row,https://economictimes.indiatimes.com/markets/stocks/news/d-street-indices-fall-for-third-day-in-a-row/articleshow/87385135.cms
10994915,Fitness planner | Long-distance cycling: from couch to 50K in 12 weeks - Month 3,https://www.moneycontrol.com/news/trends/health-trends/fitness-planner-long-distance-cycling-from-couch-to-50k-in-12-weeks-month-3-7654041.html
10994960,Covid vaccination offers higher protection than previous infection: Study,https://www.business-standard.com/article/current-affairs/covid-vaccination-offers-higher-protection-than-previous-infection-study-121103000074_1.html
10994916,Wall Street closes at new highs after day of choppy trading,https://www.moneycontrol.com/news/business/markets/wall-street-closes-at-new-highs-after-day-of-choppy-trading-7654061.html
10994917,Lottery Sambad Result October 30: 'Dear Bangasree Damodar' lottery winners to be declared at 4 pm,https://www.moneycontrol.com/news/trends/lottery-sambad-result-october-30-dear-bangasree-damodar-lottery-winners-to-be-declared-at-4-pm-7654011.html
10994918,Donald Trump's real-estate empire pays the price for poisonous politics,https://www.moneycontrol.com/news/world/donald-trumps-real-estate-empire-pays-the-price-for-poisonous-politics-7654051.html
10994919,"Petrol, diesel prices hit fresh all-time highs after 35-paise hike",https://www.moneycontrol.com/news/india/petrol-diesel-prices-hit-fresh-all-time-highs-after-35-paise-hike-7653951.html
10994920,"Cryptocurrency Prices Today: Bitcoin down 0.08%, above Rs 48 lakh on October 30",https://www.moneycontrol.com/news/business/cryptocurrency/cryptocurrency-prices-today-bitcoin-down-0-08-above-rs-48-lakh-on-october-30-7620361.html
10994922,Sigachi Industries IPO mops up Rs 38 crore from 2 anchor investors,https://www.moneycontrol.com/news/business/ipo/sigachi-industries-ipo-mops-up-rs-38-crore-from-2-anchor-investors-7653921.html
10994921,COVID-19 Vaccine | United States authorises Pfizer jabs for children 5-11,https://www.moneycontrol.com/news/world/covid-19-vaccine-united-states-authorises-pfizer-jabs-for-children-5-11-7654021.html
10994924,Why COP26 countries should not expect a net-zero pledge from India,https://www.business-standard.com/article/economy-policy/why-cop26-countries-should-not-expect-a-net-zero-pledge-from-india-121103000095_1.html
10994923,"As oil races toward $100, India, US and Japan tell OPEC+ enough is enough",https://www.business-standard.com/article/economy-policy/as-oil-races-toward-100-india-us-and-japan-tell-opec-enough-is-enough-121103000165_1.html
10994913,Tapi pipe(line) dream rises again from the ashes of the Afghan war,https://www.moneycontrol.com/news/trends/current-affairs-trends/tapi-pipeline-dream-rises-again-from-the-ashes-of-the-afghan-war-7653971.html
10994914,Moneycontrol Daily: Your Essential 7,https://www.moneycontrol.com/news/business/moneycontrol-daily-your-essential-7-171-7653911.html
10994907,When words make music in books,https://www.moneycontrol.com/news/trends/features/when-words-make-music-in-books-7653941.html
10994902,"Oil prices rebound, edge up ahead of next week's OPEC meeting",https://www.business-standard.com/article/markets/oil-prices-rebound-edge-up-ahead-of-next-week-s-opec-meeting-121103000064_1.html
10994903,"Wall Street shakes off Amazon, Apple weakness to end modestly higher",https://www.business-standard.com/article/markets/wall-street-shakes-off-amazon-apple-weakness-to-end-modestly-higher-121103000063_1.html
10994904,US intel doesn't expect to determine origins of Covid-19 pandemic,https://www.business-standard.com/article/pti-stories/us-intel-doesn-t-expect-to-determine-origins-of-covid-19-121103000022_1.html
10994905,FDA paves way for Pfizer Covid-19 vaccinations in young kids,https://www.business-standard.com/article/pti-stories/fda-paves-way-for-pfizer-covid-19-vaccinations-in-young-kids-121103000025_1.html
10994906,"Afghan situation couldn't be seen in isolation, says PM Modi in Italy",https://www.business-standard.com/article/current-affairs/afghan-situation-couldn-t-be-seen-in-isolation-says-pm-modi-in-italy-121103000059_1.html
10994908,The Metaverse is Mark Zuckerberg's escape hatch,https://www.business-standard.com/article/international/the-metaverse-is-mark-zuckerberg-s-escape-hatch-121103000055_1.html
10994909,G-20 still deadlocked as China won't budge on climate goals,https://www.business-standard.com/article/international/g-20-still-deadlocked-as-china-won-t-budge-on-climate-goals-121103000053_1.html
10994910,"Indians' belief in country's economic future has diminished, says Rajan",https://www.business-standard.com/article/current-affairs/indians-belief-in-country-s-economic-future-has-diminished-says-rajan-121103000046_1.html
10994888,Labour Min hikes minimum wages for central sphere workers from Oct 1,https://www.business-standard.com/article/current-affairs/labour-min-hikes-minimum-wages-for-central-sphere-workers-from-oct-1-121103000044_1.html
10994890,"71% MGNREGA wages not paid on time, 14% delayed beyond 30 days, study shows",https://www.business-standard.com/article/economy-policy/71-mgnrega-wages-not-paid-on-time-14-delayed-beyond-30-days-study-shows-121102901592_1.html
10994896,"Bandhan Bank suffers Rs 3,008 cr Q2 loss on higher stressed loan provisions",https://www.business-standard.com/article/companies/bandhan-bank-suffers-rs-3-008-cr-q2-loss-on-higher-stressed-loan-provisions-121102901349_1.html
